DOI,prefix,title,language,container-title,ISSN,publisher,URL,issued,published,published-online,indexed,created,reference-count,is-referenced-by-count,type,member
10.7717/peerj.10852,10.7717,Analyzing clinical characteristics of patients with different cumulative hemodialysis durations: a cross-sectional study,en,PeerJ,2167-8359,PeerJ,http://dx.doi.org/10.7717/peerj.10852,2021-3-9,2021-3-9,2021-3-9,2021-12-14,2021-3-9,29,0,journal-article,4443
10.7717/peerj.11680,10.7717,Oral function in patients with myasthenia gravis,en,PeerJ,2167-8359,PeerJ,http://dx.doi.org/10.7717/peerj.11680,2021-6-29,2021-6-29,2021-6-29,2021-12-14,2021-6-29,24,0,journal-article,4443
10.7717/peerj.12125,10.7717,Identification of immune related cells and crucial genes in the peripheral blood of ankylosing spondylitis by integrated bioinformatics analysis,en,PeerJ,2167-8359,PeerJ,http://dx.doi.org/10.7717/peerj.12125,2021-9-7,2021-9-7,2021-9-7,2021-12-14,2021-9-7,55,0,journal-article,4443
10.7717/peerj.12244,10.7717,"Preliminary placement and new records of an overlooked Amazonian tree, Christiana mennegae (Malvaceae)",en,PeerJ,2167-8359,PeerJ,http://dx.doi.org/10.7717/peerj.12244,2021-11-15,2021-11-15,2021-11-15,2021-12-14,2021-11-15,68,0,journal-article,4443
10.7717/peerj.10622,10.7717,Stage 1 registered report: spatiotemporal patterns of the COVID-19 epidemic in Mexico at the municipality level,en,PeerJ,2167-8359,PeerJ,http://dx.doi.org/10.7717/peerj.10622,2021-2-5,2021-2-5,2021-2-5,2021-12-14,2021-2-5,25,0,journal-article,4443
10.7717/peerj.11858,10.7717,Online search trends and word-related emotional response during COVID-19 lockdown in Italy: a cross-sectional online study,en,PeerJ,2167-8359,PeerJ,http://dx.doi.org/10.7717/peerj.11858,2021-8-10,2021-8-10,2021-8-10,2021-12-14,2021-8-10,46,2,journal-article,4443
10.7717/peerj.12202,10.7717,Estrogen receptor—positive breast cancer survival prediction and analysis of resistance–related genes introduction,en,PeerJ,2167-8359,PeerJ,http://dx.doi.org/10.7717/peerj.12202,2021-10-26,2021-10-26,2021-10-26,2021-12-14,2021-10-26,47,0,journal-article,4443
10.7717/peerj.12418,10.7717,Phylogeny of Crataegus (Rosaceae) based on 257 nuclear loci and chloroplast genomes: evaluating the impact of hybridization,en,PeerJ,2167-8359,PeerJ,http://dx.doi.org/10.7717/peerj.12418,2021-10-26,2021-10-26,2021-10-26,2021-12-16,2021-10-26,126,0,journal-article,4443
10.7717/peerj.11068,10.7717,Influence of sex and maturity state on trace elements content in liver and muscle of the SciaenidaeTotoaba macdonaldi,en,PeerJ,2167-8359,PeerJ,http://dx.doi.org/10.7717/peerj.11068,2021-4-8,2021-4-8,2021-4-8,2021-12-15,2021-4-8,68,0,journal-article,4443
10.7717/peerj.10768,10.7717,Homeostatic responses and growth of Leymus chinensis under incrementally increasing saline-alkali stress,en,PeerJ,2167-8359,PeerJ,http://dx.doi.org/10.7717/peerj.10768,2021-3-1,2021-3-1,2021-3-1,2021-12-15,2021-3-1,38,0,journal-article,4443
10.7717/peerj.12430,10.7717,Heavy metal pollution characteristics and health risk assessment of dust fall related to industrial activities in desert steppes,en,PeerJ,2167-8359,PeerJ,http://dx.doi.org/10.7717/peerj.12430,2021-11-3,2021-11-3,2021-11-3,2021-12-15,2021-11-3,86,0,journal-article,4443
10.7717/peerj.11187,10.7717,Honey bees communicate distance via non-linear waggle duration functions,en,PeerJ,2167-8359,PeerJ,http://dx.doi.org/10.7717/peerj.11187,2021-4-5,2021-4-5,2021-4-5,2021-12-15,2021-4-5,50,0,journal-article,4443
10.7717/peerj.11176,10.7717,Genome-wide identification and expression analysis of the EXO70 gene family in grape (Vitis vinifera L),en,PeerJ,2167-8359,PeerJ,http://dx.doi.org/10.7717/peerj.11176,2021-4-21,2021-4-21,2021-4-21,2021-12-15,2021-4-21,57,0,journal-article,4443
10.7717/peerj.10979,10.7717,"Impact of organic manure on fruit set, fruit retention, yield, and nutritional status in pomegranate (Punica granatum L. “Wonderful”) under water and mineral fertilization deficits",en,PeerJ,2167-8359,PeerJ,http://dx.doi.org/10.7717/peerj.10979,2021-3-3,2021-3-3,2021-3-3,2021-12-15,2021-3-3,59,1,journal-article,4443
10.7717/peerj.11856,10.7717,Anti-clustering in the national SARS-CoV-2 daily infection counts,en,PeerJ,2167-8359,PeerJ,http://dx.doi.org/10.7717/peerj.11856,2021-8-27,2021-8-27,2021-8-27,2021-12-15,2021-8-27,64,1,journal-article,4443
10.7717/peerj.12994,10.7717,Analysis of the role and mechanism of EGCG in septic cardiomyopathy based on network pharmacology,en,PeerJ,2167-8359,PeerJ,http://dx.doi.org/10.7717/peerj.12994,2022-3-9,2022-3-9,2022-3-9,2022-3-9,2022-3-9,51,0,journal-article,4443
10.7717/peerj.12737,10.7717,"Isolation and transcriptome analysis of a biotechnologically promising Black Sea protist, <i>Thraustochytrium aureum ssp. strugatskii</i>",en,PeerJ,2167-8359,PeerJ,http://dx.doi.org/10.7717/peerj.12737,2022-3-9,2022-3-9,2022-3-9,2022-3-9,2022-3-9,70,0,journal-article,4443
10.7717/peerj.11810,10.7717,Genome-wide identification of candidate aquaporins involved in water accumulation of pomegranate outer seed coat,en,PeerJ,2167-8359,PeerJ,http://dx.doi.org/10.7717/peerj.11810,2021-7-15,2021-7-15,2021-7-15,2022-3-9,2021-7-15,97,1,journal-article,4443
10.7717/peerj.12734,10.7717,Three new species of <i>Microlaimus</i> (Nematoda: Microlaimidae) from the South Atlantic,en,PeerJ,2167-8359,PeerJ,http://dx.doi.org/10.7717/peerj.12734,2022-3-9,2022-3-9,2022-3-9,2022-3-9,2022-3-9,58,0,journal-article,4443
10.7717/peerj.10870,10.7717,Undiagnosed cardiovascular risk factors in overweight and obese individuals: a low income country experience,en,PeerJ,2167-8359,PeerJ,http://dx.doi.org/10.7717/peerj.10870,2021-2-2,2021-2-2,2021-2-2,2022-3-9,2021-2-2,26,1,journal-article,4443
10.7717/peerj.13071,10.7717,Long-term consumption of artificial sweeteners does not affect cardiovascular health and survival in rats,en,PeerJ,2167-8359,PeerJ,http://dx.doi.org/10.7717/peerj.13071,2022-3-9,2022-3-9,2022-3-9,2022-3-9,2022-3-9,36,0,journal-article,4443
10.7717/peerj.11423,10.7717,GBP2 as a potential prognostic biomarker in pancreatic adenocarcinoma,en,PeerJ,2167-8359,PeerJ,http://dx.doi.org/10.7717/peerj.11423,2021-5-11,2021-5-11,2021-5-11,2022-3-9,2021-5-11,36,4,journal-article,4443
10.7717/peerj.12496,10.7717,Identification and pathogenicity of Alternaria species associated with leaf blotch disease and premature defoliation in French apple orchards,en,PeerJ,2167-8359,PeerJ,http://dx.doi.org/10.7717/peerj.12496,2021-12-1,2021-12-1,2021-12-1,2022-3-9,2021-12-1,47,1,journal-article,4443
10.7717/peerj.10647,10.7717,Refining the marine reptile turnover at the Early–Middle Jurassic transition,en,PeerJ,2167-8359,PeerJ,http://dx.doi.org/10.7717/peerj.10647,2021-2-22,2021-2-22,2021-2-22,2022-3-9,2021-2-22,222,3,journal-article,4443
10.7717/peerj.11224,10.7717,Whole genome sequence analysis of multi drug resistant community associated methicillin resistant Staphylococcus aureus from food fish: detection of clonal lineage ST 28 and its antimicrobial resistance and virulence genes,en,PeerJ,2167-8359,PeerJ,http://dx.doi.org/10.7717/peerj.11224,2021-5-24,2021-5-24,2021-5-24,2021-12-17,2021-5-24,52,0,journal-article,4443
10.7717/peerj.11725,10.7717,Quail eggs in artificial nests change their coloration when exposed to ambient conditions: implication for studies on nest predation,en,PeerJ,2167-8359,PeerJ,http://dx.doi.org/10.7717/peerj.11725,2021-7-6,2021-7-6,2021-7-6,2021-12-16,2021-7-6,41,0,journal-article,4443
10.7717/peerj.10531,10.7717,"A new species of Munida Leach, 1820 (Crustacea: Decapoda: Anomura: Munididae) from seamounts of the Nazca-Desventuradas Marine Park",en,PeerJ,2167-8359,PeerJ,http://dx.doi.org/10.7717/peerj.10531,2021-1-5,2021-1-5,2021-1-5,2021-12-17,2021-1-5,49,1,journal-article,4443
10.7717/peerj.12118,10.7717,The LEAF questionnaire is a good screening tool for the identification of the Female Athlete Triad/Relative Energy Deficiency in Sport among young football players,en,PeerJ,2167-8359,PeerJ,http://dx.doi.org/10.7717/peerj.12118,2021-9-3,2021-9-3,2021-9-3,2021-12-17,2021-9-6,31,0,journal-article,4443
10.7717/peerj.12238,10.7717,"Differential response of distinct copepod life history types to spring environmental forcing in Rivers Inlet, British Columbia, Canada",en,PeerJ,2167-8359,PeerJ,http://dx.doi.org/10.7717/peerj.12238,2021-10-18,2021-10-18,2021-10-18,2021-12-17,2021-10-18,64,0,journal-article,4443
10.7717/peerj.12214,10.7717,Efficacy of 4% articaine vs 2% lidocaine in mandibular and maxillary block and infiltration anaesthesia in patients with irreversible pulpitis: a systematic review and meta-analysis,en,PeerJ,2167-8359,PeerJ,http://dx.doi.org/10.7717/peerj.12214,2021-9-24,2021-9-24,2021-9-24,2021-12-16,2021-9-24,57,0,journal-article,4443
10.7717/peerj.11995,10.7717,The modulatory properties of Astragalus membranaceus treatment on endometrial cancer: an integrated pharmacological method,en,PeerJ,2167-8359,PeerJ,http://dx.doi.org/10.7717/peerj.11995,2021-8-24,2021-8-24,2021-8-24,2021-12-16,2021-8-24,70,1,journal-article,4443
10.7717/peerj.11184,10.7717,Soil microbial diversity in organic and non-organic pasture systems,en,PeerJ,2167-8359,PeerJ,http://dx.doi.org/10.7717/peerj.11184,2021-4-22,2021-4-22,2021-4-22,2021-12-16,2021-4-22,78,1,journal-article,4443
10.7717/peerj.11381,10.7717,A novel one-step quick assay for detection of SARS-COV2 antibodies across mammalian species,en,PeerJ,2167-8359,PeerJ,http://dx.doi.org/10.7717/peerj.11381,2021-4-27,2021-4-27,2021-4-27,2021-12-16,2021-4-27,7,3,journal-article,4443
10.7717/peerj.12604,10.7717,A short scale for measuring attitudes towards the doctor-patient relationship: psychometric properties and measurement invariance of the German Patient-Practitioner-Orientation Scale (PPOS-D6),en,PeerJ,2167-8359,PeerJ,http://dx.doi.org/10.7717/peerj.12604,2021-12-8,2021-12-8,2021-12-8,2021-12-16,2021-12-8,45,0,journal-article,4443
10.7717/peerj.11741,10.7717,Assessing the diversity of whiteflies infesting cassava in Brazil,en,PeerJ,2167-8359,PeerJ,http://dx.doi.org/10.7717/peerj.11741,2021-7-15,2021-7-15,2021-7-15,2021-12-16,2021-7-15,114,0,journal-article,4443
10.7717/peerj.11911,10.7717,A four-gene prognostic signature for predicting the overall survival of patients with lung adenocarcinoma,en,PeerJ,2167-8359,PeerJ,http://dx.doi.org/10.7717/peerj.11911,2021-9-23,2021-9-23,2021-9-23,2021-12-16,2021-9-23,27,1,journal-article,4443
10.7717/peerj.11971,10.7717,Active behaviour of terrestrial caterpillars on the water surface,en,PeerJ,2167-8359,PeerJ,http://dx.doi.org/10.7717/peerj.11971,2021-9-13,2021-9-13,2021-9-13,2021-12-17,2021-9-13,39,0,journal-article,4443
10.7717/peerj.11527,10.7717,"Nacre morphology and chemical composition in Atlantic winged oyster Pteria colymbus (Röding, 1798)",en,PeerJ,2167-8359,PeerJ,http://dx.doi.org/10.7717/peerj.11527,2021-7-15,2021-7-15,2021-7-15,2021-12-17,2021-7-15,49,0,journal-article,4443
10.7717/peerj.12003,10.7717,Ciprofloxacin reduces tenocyte viability and proteoglycan synthesis in short-term explant cultures of equine tendon,en,PeerJ,2167-8359,PeerJ,http://dx.doi.org/10.7717/peerj.12003,2021-8-30,2021-8-30,2021-8-30,2021-12-17,2021-8-30,43,0,journal-article,4443
10.7717/peerj.12442,10.7717,Locomotor behavior of Neocaridina palmata: a study with leachates from UV-weathered microplastics,en,PeerJ,2167-8359,PeerJ,http://dx.doi.org/10.7717/peerj.12442,2021-11-9,2021-11-9,2021-11-9,2021-12-17,2021-11-9,74,0,journal-article,4443
10.7717/peerj.11054,10.7717,First days at sea: depicting migration patterns of juvenile seabirds in highly impacted seascapes,en,PeerJ,2167-8359,PeerJ,http://dx.doi.org/10.7717/peerj.11054,2021-5-11,2021-5-11,2021-5-11,2021-12-17,2021-5-11,50,0,journal-article,4443
10.7717/peerj.12959,10.7717,Prevalence of iron deficiency anemia in Brazilian women of childbearing age: a systematic review with meta-analysis,en,PeerJ,2167-8359,PeerJ,http://dx.doi.org/10.7717/peerj.12959,2022-2-17,2022-2-17,2022-2-17,2022-2-17,2022-2-17,126,0,journal-article,4443
10.7717/peerj.12980,10.7717,"Molecular characterization and expression profiling of transformer 2 and fruitless-like homologs in the black tiger shrimp, Penaeus monodon",en,PeerJ,2167-8359,PeerJ,http://dx.doi.org/10.7717/peerj.12980,2022-2-17,2022-2-17,2022-2-17,2022-2-17,2022-2-17,64,0,journal-article,4443
10.7717/peerj.11676,10.7717,Confidence intervals for the difference between the coefficients of variation of Weibull distributions for analyzing wind speed dispersion,en,PeerJ,2167-8359,PeerJ,http://dx.doi.org/10.7717/peerj.11676,2021-7-2,2021-7-2,2021-7-2,2022-2-17,2021-7-2,34,2,journal-article,4443
10.7717/peerj.11929,10.7717,DUSP12 regulates the tumorigenesis and prognosis of hepatocellular carcinoma,en,PeerJ,2167-8359,PeerJ,http://dx.doi.org/10.7717/peerj.11929,2021-8-3,2021-8-3,2021-8-3,2022-2-17,2021-8-3,53,1,journal-article,4443
10.7717/peerj.12926,10.7717,The coalescent with replication-independent mutations,en,PeerJ,2167-8359,PeerJ,http://dx.doi.org/10.7717/peerj.12926,2022-2-15,2022-2-15,2022-2-15,2022-2-15,2022-2-15,12,0,journal-article,4443
10.7717/peerj.12934,10.7717,Human cytomegalovirus infection and its association with gestational diabetes mellitus during pregnancy,en,PeerJ,2167-8359,PeerJ,http://dx.doi.org/10.7717/peerj.12934,2022-2-15,2022-2-15,2022-2-15,2022-2-15,2022-2-15,26,0,journal-article,4443
10.7717/peerj.11499,10.7717,Spatial-temporal variability of Mytilus galloprovincialis Lamarck 1819 populations and their accumulated sediment in northern Portugal,en,PeerJ,2167-8359,PeerJ,http://dx.doi.org/10.7717/peerj.11499,2021-6-22,2021-6-22,2021-6-22,2022-2-14,2021-6-22,65,1,journal-article,4443
10.7717/peerj.12088,10.7717,Determining relevant traits for selecting landrace accessions of Phaseolus lunatus L. for insect resistance,en,PeerJ,2167-8359,PeerJ,http://dx.doi.org/10.7717/peerj.12088,2021-9-16,2021-9-16,2021-9-16,2022-2-14,2021-9-16,66,1,journal-article,4443
10.7717/peerj.12957,10.7717,Quantification of human enteric viruses as alternative indicators of fecal pollution to evaluate wastewater treatment processes,en,PeerJ,2167-8359,PeerJ,http://dx.doi.org/10.7717/peerj.12957,2022-2-14,2022-2-14,2022-2-14,2022-2-14,2022-2-14,83,0,journal-article,4443
10.7717/peerj.12901,10.7717,Drivers of phenotypic divergence in a Mesoamerican highland bird,en,PeerJ,2167-8359,PeerJ,http://dx.doi.org/10.7717/peerj.12901,2022-2-18,2022-2-18,2022-2-18,2022-2-18,2022-2-18,68,0,journal-article,4443
10.7717/peerj.12964,10.7717,Climate in Africa sequentially shapes spring passage of Willow Warbler Phylloscopus trochilus across the Baltic coast,en,PeerJ,2167-8359,PeerJ,http://dx.doi.org/10.7717/peerj.12964,2022-2-18,2022-2-18,2022-2-18,2022-2-18,2022-2-18,115,0,journal-article,4443
10.7717/peerj.12968,10.7717,Comparative transcriptome analysis provides insights into grain filling commonalities and differences between foxtail millet [Setaria italica (L.) P. Beauv.] varieties with different panicle types,en,PeerJ,2167-8359,PeerJ,http://dx.doi.org/10.7717/peerj.12968,2022-2-18,2022-2-18,2022-2-18,2022-2-18,2022-2-18,50,0,journal-article,4443
10.7717/peerj.11607,10.7717,"Muvi schmallenbergi gen. nov., sp. nov. (Crustacea, Tanaidacea) from the southeast Australian coast, with comments on the distribution and habitat preferences of Chondropodinae",en,PeerJ,2167-8359,PeerJ,http://dx.doi.org/10.7717/peerj.11607,2021-8-11,2021-8-11,2021-8-11,2022-2-18,2021-8-11,65,2,journal-article,4443
10.7717/peerj.11004,10.7717,Plyometric jump training effects on the physical fitness of individual-sport athletes: a systematic review with meta-analysis,en,PeerJ,2167-8359,PeerJ,http://dx.doi.org/10.7717/peerj.11004,2021-3-1,2021-3-1,2021-3-1,2022-2-18,2021-3-1,97,2,journal-article,4443
10.7717/peerj.10761,10.7717,"Rapid coral reef assessment using 3D modelling and acoustics: acoustic indices correlate to fish abundance, diversity and environmental indicators in West Papua, Indonesia",en,PeerJ,2167-8359,PeerJ,http://dx.doi.org/10.7717/peerj.10761,2021-2-8,2021-2-8,2021-2-8,2022-2-25,2021-2-8,57,4,journal-article,4443
10.7717/peerj.11126,10.7717,Immunoinformatic approach to design a multiepitope vaccine targeting non-mutational hotspot regions of structural and non-structural proteins of the SARS CoV2,en,PeerJ,2167-8359,PeerJ,http://dx.doi.org/10.7717/peerj.11126,2021-3-23,2021-3-23,2021-3-23,2022-2-25,2021-3-23,64,2,journal-article,4443
10.7717/peerj.11173,10.7717,Olive leaf extract effect on cardiometabolic profile among adults with prehypertension and hypertension: a systematic review and meta-analysis,en,PeerJ,2167-8359,PeerJ,http://dx.doi.org/10.7717/peerj.11173,2021-4-7,2021-4-7,2021-4-7,2022-2-24,2021-4-7,38,1,journal-article,4443
10.7717/peerj.10848,10.7717,NFIB promotes the migration and progression of kidney renal clear cell carcinoma by regulating PINK1 transcription,en,PeerJ,2167-8359,PeerJ,http://dx.doi.org/10.7717/peerj.10848,2021-4-23,2021-4-23,2021-4-23,2022-2-24,2021-4-23,33,1,journal-article,4443
10.7717/peerj.12359,10.7717,Horsenettle (Solanum carolinense) fruit bacterial communities are not variable across fine spatial scales,en,PeerJ,2167-8359,PeerJ,http://dx.doi.org/10.7717/peerj.12359,2021-11-8,2021-11-8,2021-11-8,2021-12-18,2021-11-8,73,0,journal-article,4443
10.7717/peerj.11252,10.7717,Assessment of hand function in women with lymphadenopathy after radical mastectomy,en,PeerJ,2167-8359,PeerJ,http://dx.doi.org/10.7717/peerj.11252,2021-4-13,2021-4-13,2021-4-13,2021-12-17,2021-4-13,26,0,journal-article,4443
10.7717/peerj.11758,10.7717,Childhood maltreatment and suicidal ideation in Chinese children and adolescents: the mediation of resilience,en,PeerJ,2167-8359,PeerJ,http://dx.doi.org/10.7717/peerj.11758,2021-7-6,2021-7-6,2021-7-6,2021-12-17,2021-7-6,45,0,journal-article,4443
10.7717/peerj.12601,10.7717,The influence of rhizosphere soil fungal diversity and complex community structure on wheat root rot disease,en,PeerJ,2167-8359,PeerJ,http://dx.doi.org/10.7717/peerj.12601,2021-12-13,2021-12-13,2021-12-13,2021-12-17,2021-12-13,72,0,journal-article,4443
10.7717/peerj.12522,10.7717,Long-term follow-up of applying autologous bone grafts for reconstructing tympanomastoid defects in functional cholesteatoma surgery,en,PeerJ,2167-8359,PeerJ,http://dx.doi.org/10.7717/peerj.12522,2021-11-23,2021-11-23,2021-11-23,2021-12-17,2021-11-23,37,0,journal-article,4443
10.7717/peerj.12510,10.7717,Zoledronic acid promotes osteoclasts ferroptosis by inhibiting FBXO9-mediated p53 ubiquitination and degradation,en,PeerJ,2167-8359,PeerJ,http://dx.doi.org/10.7717/peerj.12510,2021-12-16,2021-12-16,2021-12-16,2021-12-17,2021-12-16,33,0,journal-article,4443
10.7717/peerj.11344,10.7717,Robustness analysis of metabolic predictions in algal microbial communities based on different annotation pipelines,en,PeerJ,2167-8359,PeerJ,http://dx.doi.org/10.7717/peerj.11344,2021-5-6,2021-5-6,2021-5-6,2021-12-17,2021-5-6,45,0,journal-article,4443
10.7717/peerj.10658,10.7717,Ballroom dancers exhibit a dispositional need for arousal and elevated cerebral cortical activity during preferred melodic recall,en,PeerJ,2167-8359,PeerJ,http://dx.doi.org/10.7717/peerj.10658,2021-1-13,2021-1-13,2021-1-13,2021-12-18,2021-1-13,73,0,journal-article,4443
10.7717/peerj.11850,10.7717,causalizeR: a text mining algorithm to identify causal relationships in scientific literature,en,PeerJ,2167-8359,PeerJ,http://dx.doi.org/10.7717/peerj.11850,2021-7-20,2021-7-20,2021-7-20,2021-12-18,2021-7-20,22,0,journal-article,4443
10.7717/peerj.11301,10.7717,Assessing kinesthetic proprioceptive function of the upper limb: a novel dynamic movement reproduction task using a robotic arm,en,PeerJ,2167-8359,PeerJ,http://dx.doi.org/10.7717/peerj.11301,2021-5-3,2021-5-3,2021-5-3,2021-12-18,2021-5-3,40,0,journal-article,4443
10.7717/peerj.12600,10.7717,Transcriptome atlas of Phalaenopsis equestris,en,PeerJ,2167-8359,PeerJ,http://dx.doi.org/10.7717/peerj.12600,2021-12-10,2021-12-10,2021-12-10,2021-12-21,2021-12-10,38,0,journal-article,4443
10.7717/peerj.11376,10.7717,"ProkEvo: an automated, reproducible, and scalable framework for high-throughput bacterial population genomics analyses",en,PeerJ,2167-8359,PeerJ,http://dx.doi.org/10.7717/peerj.11376,2021-5-21,2021-5-21,2021-5-21,2021-12-21,2021-5-21,109,2,journal-article,4443
10.7717/peerj.10909,10.7717,"Resistance training with different repetition duration to failure: effect on hypertrophy, strength and muscle activation",en,PeerJ,2167-8359,PeerJ,http://dx.doi.org/10.7717/peerj.10909,2021-2-25,2021-2-25,2021-2-25,2021-12-21,2021-2-25,42,1,journal-article,4443
10.7717/peerj.12072,10.7717,Investigation of inhibition effect of daidzein on osteosarcoma cells based on experimental validation and systematic pharmacology analysis,en,PeerJ,2167-8359,PeerJ,http://dx.doi.org/10.7717/peerj.12072,2021-8-31,2021-8-31,2021-8-31,2021-12-21,2021-8-31,41,0,journal-article,4443
10.7717/peerj.11248,10.7717,"Chemosensitivity and role of swimming legs of mud crab,Scylla paramamosain,in feeding activity as determined by electrocardiographic and behavioural observations",en,PeerJ,2167-8359,PeerJ,http://dx.doi.org/10.7717/peerj.11248,2021-4-21,2021-4-21,2021-4-21,2021-12-21,2021-4-21,47,0,journal-article,4443
10.7717/peerj.12370,10.7717,Effect of SARS-CoV-2 infection on host competing endogenous RNA and miRNA network,en,PeerJ,2167-8359,PeerJ,http://dx.doi.org/10.7717/peerj.12370,2021-10-20,2021-10-20,2021-10-20,2021-12-21,2021-10-20,54,0,journal-article,4443
10.7717/peerj.12188,10.7717,The effect of cartilage decellularized extracellular matrix-chitosan compound on treating knee osteoarthritis in rats,en,PeerJ,2167-8359,PeerJ,http://dx.doi.org/10.7717/peerj.12188,2021-10-12,2021-10-12,2021-10-12,2021-12-21,2021-10-12,38,0,journal-article,4443
10.7717/peerj.10997,10.7717,The disturbance leg-lift response (DLR): an undescribed behavior in bumble bees,en,PeerJ,2167-8359,PeerJ,http://dx.doi.org/10.7717/peerj.10997,2021-3-25,2021-3-25,2021-3-25,2021-12-21,2021-3-25,78,2,journal-article,4443
10.7717/peerj.11910,10.7717,Identification of miRNA-target gene regulatory networks in liver fibrosis based on bioinformatics analysis,en,PeerJ,2167-8359,PeerJ,http://dx.doi.org/10.7717/peerj.11910,2021-8-6,2021-8-6,2021-8-6,2021-12-21,2021-8-6,45,1,journal-article,4443
10.7717/peerj.12574,10.7717,Whole-limb scaling of muscle mass and force-generating capacity in amniotes,en,PeerJ,2167-8359,PeerJ,http://dx.doi.org/10.7717/peerj.12574,2021-11-29,2021-11-29,2021-11-29,2021-12-20,2021-11-29,90,0,journal-article,4443
10.7717/peerj.11934,10.7717,The nutritional applications of garlic (Allium sativum) as natural feed additives in animals,en,PeerJ,2167-8359,PeerJ,http://dx.doi.org/10.7717/peerj.11934,2021-8-10,2021-8-10,2021-8-10,2021-12-20,2021-8-10,85,0,journal-article,4443
10.7717/peerj.10676,10.7717,"Offshore marine actinopterygian assemblages from the Maastrichtian–Paleogene of the Pindos Unit in Eurytania, Greece",en,PeerJ,2167-8359,PeerJ,http://dx.doi.org/10.7717/peerj.10676,2021-1-20,2021-1-20,2021-1-20,2021-12-20,2021-1-20,146,1,journal-article,4443
10.7717/peerj.10937,10.7717,Pushing up or pushing out—an initial investigation into horizontal- versus vertical-force training on swimming start performance: a pilot study,en,PeerJ,2167-8359,PeerJ,http://dx.doi.org/10.7717/peerj.10937,2021-2-24,2021-2-24,2021-2-24,2021-12-20,2021-2-24,41,0,journal-article,4443
10.7717/peerj.12450,10.7717,treedata.table: a wrapper for data.table that enables fast manipulation of large phylogenetic trees matched to data,en,PeerJ,2167-8359,PeerJ,http://dx.doi.org/10.7717/peerj.12450,2021-11-26,2021-11-26,2021-11-26,2021-12-21,2021-11-26,24,0,journal-article,4443
10.7717/peerj.10753,10.7717,The longitudinal associations between bone mineral density and appendicular skeletal muscle mass in Chinese community-dwelling middle aged and elderly men,en,PeerJ,2167-8359,PeerJ,http://dx.doi.org/10.7717/peerj.10753,2021-1-19,2021-1-19,2021-1-19,2021-12-21,2021-1-19,47,0,journal-article,4443
10.7717/peerj.11328,10.7717,Co-application of mineral and organic fertilizers under deficit irrigation improves the fruit quality of the Wonderful pomegranate,en,PeerJ,2167-8359,PeerJ,http://dx.doi.org/10.7717/peerj.11328,2021-5-18,2021-5-18,2021-5-18,2021-12-21,2021-5-18,48,0,journal-article,4443
10.7717/peerj.12530,10.7717,"First report of the genus Bicorniphontodes (Copepoda, Harpacticoida, Ancorabolidae) in South Korea, with descriptions of three new species",en,PeerJ,2167-8359,PeerJ,http://dx.doi.org/10.7717/peerj.12530,2021-12-7,2021-12-7,2021-12-7,2021-12-21,2021-12-7,32,0,journal-article,4443
10.7717/peerj.11646,10.7717,Expression of thermophilic two-domain laccase from Catenuloplanes japonicus in Escherichia coli and its activity against triarylmethane and azo dyes,en,PeerJ,2167-8359,PeerJ,http://dx.doi.org/10.7717/peerj.11646,2021-6-24,2021-6-24,2021-6-24,2021-12-21,2021-6-24,47,1,journal-article,4443
10.7717/peerj.10841,10.7717,The kinematic analysis of the lower limb during topspin forehand loop between different level table tennis athletes,en,PeerJ,2167-8359,PeerJ,http://dx.doi.org/10.7717/peerj.10841,2021-3-12,2021-3-12,2021-3-12,2021-12-21,2021-3-12,25,5,journal-article,4443
10.7717/peerj.12201,10.7717,Impacts of climate change on water resources in the major countries along the Belt and Road,en,PeerJ,2167-8359,PeerJ,http://dx.doi.org/10.7717/peerj.12201,2021-10-12,2021-10-12,2021-10-12,2021-12-22,2021-10-12,71,0,journal-article,4443
10.7717/peerj.10679,10.7717,Reproducing country-wide COVID-19 dynamics can require the usage of a set of SIR systems,en,PeerJ,2167-8359,PeerJ,http://dx.doi.org/10.7717/peerj.10679,2021-1-7,2021-1-7,2021-1-7,2021-12-22,2021-1-7,34,1,journal-article,4443
