DOI,prefix,title,language,container-title,ISSN,publisher,URL,issued,published,published-online,indexed,created,reference-count,is-referenced-by-count,type,member
10.7717/peerj.12469,10.7717,Environmental changes in Yellow River Delta with terrace construction and agricultural cropping,en,PeerJ,2167-8359,PeerJ,http://dx.doi.org/10.7717/peerj.12469,2021-11-11,2021-11-11,2021-11-11,2021-12-12,2021-11-11,45,0,journal-article,4443
10.7717/peerj.11579,10.7717,The impact of mental and somatic stressors on physical activity and sedentary behaviour in adults with type 2 diabetes mellitus: a diary study,en,PeerJ,2167-8359,PeerJ,http://dx.doi.org/10.7717/peerj.11579,2021-6-18,2021-6-18,2021-6-18,2021-12-12,2021-6-18,53,0,journal-article,4443
10.7717/peerj.11984,10.7717,Behavioral phenotyping of cancer pain in domesticated cats with naturally occurring squamous cell carcinoma of the tongue: initial validation studies provide evidence for regional and widespread algoplasticity,en,PeerJ,2167-8359,PeerJ,http://dx.doi.org/10.7717/peerj.11984,2021-8-16,2021-8-16,2021-8-16,2021-12-11,2021-8-16,71,0,journal-article,4443
10.7717/peerj.10473,10.7717,Flower visitors of Streptocarpus teitensis: implications for conservation of a critically endangered African violet species in Kenya,en,PeerJ,2167-8359,PeerJ,http://dx.doi.org/10.7717/peerj.10473,2021-1-26,2021-1-26,2021-1-26,2021-12-15,2021-1-26,45,1,journal-article,4443
10.7717/peerj.11629,10.7717,Discrete simulation analysis of COVID-19 and prediction of isolation bed numbers,en,PeerJ,2167-8359,PeerJ,http://dx.doi.org/10.7717/peerj.11629,2021-6-23,2021-6-23,2021-6-23,2021-12-14,2021-6-23,34,0,journal-article,4443
10.7717/peerj.11354,10.7717,A Python script to merge Sanger sequences,en,PeerJ,2167-8359,PeerJ,http://dx.doi.org/10.7717/peerj.11354,2021-4-27,2021-4-27,2021-4-27,2021-12-14,2021-4-27,23,0,journal-article,4443
10.7717/peerj.11525,10.7717,Lipid accumulation of Chlorella sp. TLD6B from the Taklimakan Desert under salt stress,en,PeerJ,2167-8359,PeerJ,http://dx.doi.org/10.7717/peerj.11525,2021-5-31,2021-5-31,2021-5-31,2021-12-20,2021-5-31,58,0,journal-article,4443
10.7717/peerj.10523,10.7717,Mitochondrial genomes of eight Scelimeninae species (Orthoptera) and their phylogenetic implications within Tetrigoidea,en,PeerJ,2167-8359,PeerJ,http://dx.doi.org/10.7717/peerj.10523,2021-2-2,2021-2-2,2021-2-2,2022-2-3,2021-2-2,54,1,journal-article,4443
10.7717/peerj.11087,10.7717,Utilizing network pharmacology and molecular docking to explore the underlying mechanism of Guizhi Fuling Wan in treating endometriosis,en,PeerJ,2167-8359,PeerJ,http://dx.doi.org/10.7717/peerj.11087,2021-4-2,2021-4-2,2021-4-2,2022-2-7,2021-4-2,66,4,journal-article,4443
10.7717/peerj.10782,10.7717,"Phenotypic, molecular and pathogenic characterization of Colletotrichum scovillei infecting Capsicum species in Rio de Janeiro, Brazil",en,PeerJ,2167-8359,PeerJ,http://dx.doi.org/10.7717/peerj.10782,2021-4-27,2021-4-27,2021-4-27,2022-2-7,2021-4-27,71,2,journal-article,4443
10.7717/peerj.11110,10.7717,Ameliorative effect of apelin-13 against renal complications in L-NAME-induced preeclampsia in rats,en,PeerJ,2167-8359,PeerJ,http://dx.doi.org/10.7717/peerj.11110,2021-3-31,2021-3-31,2021-3-31,2022-2-8,2021-3-31,44,10,journal-article,4443
10.7717/peerj.11622,10.7717,"Using an integrative taxonomic approach to delimit a sibling species, Mycetomoellerius mikromelanos sp. nov. (Formicidae: Attini: Attina)",en,PeerJ,2167-8359,PeerJ,http://dx.doi.org/10.7717/peerj.11622,2021-6-24,2021-6-24,2021-6-24,2021-12-9,2021-6-24,107,0,journal-article,4443
10.7717/peerj.11775,10.7717,"A molecular phylogeny of the Chinese Sinopoda spiders (Sparassidae, Heteropodinae): implications for taxonomy",en,PeerJ,2167-8359,PeerJ,http://dx.doi.org/10.7717/peerj.11775,2021-8-20,2021-8-20,2021-8-20,2021-12-9,2021-8-20,35,0,journal-article,4443
10.7717/peerj.12248,10.7717,Application of intra-arterial chemotherapy in high-risk non-muscle invasive bladder cancer: a systematic review and meta-analysis,en,PeerJ,2167-8359,PeerJ,http://dx.doi.org/10.7717/peerj.12248,2021-9-28,2021-9-28,2021-9-28,2021-12-9,2021-9-28,33,0,journal-article,4443
10.7717/peerj.11338,10.7717,Comparative phylogeography uncovers evolutionary past of Holarctic dragonflies,en,PeerJ,2167-8359,PeerJ,http://dx.doi.org/10.7717/peerj.11338,2021-6-24,2021-6-24,2021-6-24,2021-12-9,2021-6-24,69,0,journal-article,4443
10.7717/peerj.11953,10.7717,Non-linear genetic diversity and notable population differentiation caused by low gene flow of bermudagrass [Cynodon dactylon (L.) Pers.] along longitude gradients,en,PeerJ,2167-8359,PeerJ,http://dx.doi.org/10.7717/peerj.11953,2021-8-17,2021-8-17,2021-8-17,2021-12-16,2021-8-17,96,0,journal-article,4443
10.7717/peerj.11518,10.7717,Current status of Helicobacter pylori resistance to Clarithromycin and Levofloxacin in Malaysia—findings from a molecular based study,en,PeerJ,2167-8359,PeerJ,http://dx.doi.org/10.7717/peerj.11518,2021-6-9,2021-6-9,2021-6-9,2021-12-16,2021-6-9,42,0,journal-article,4443
10.7717/peerj.11795,10.7717,Cellulose aerogel composites as oil sorbents and their regeneration,en,PeerJ,2167-8359,PeerJ,http://dx.doi.org/10.7717/peerj.11795,2021-8-3,2021-8-3,2021-8-3,2021-12-16,2021-8-3,52,0,journal-article,4443
10.7717/peerj.11481,10.7717,Microsatellite instability and Epstein-Barr virus combined with PD-L1 could serve as a potential strategy for predicting the prognosis and efficacy of postoperative chemotherapy in gastric cancer,en,PeerJ,2167-8359,PeerJ,http://dx.doi.org/10.7717/peerj.11481,2021-5-18,2021-5-18,2021-5-18,2021-12-16,2021-5-18,35,1,journal-article,4443
10.7717/peerj.12145,10.7717,Transcriptome analysis of ovary culture-induced embryogenesis in cucumber (Cucumis sativus L.),en,PeerJ,2167-8359,PeerJ,http://dx.doi.org/10.7717/peerj.12145,2021-12-15,2021-12-15,2021-12-15,2021-12-16,2021-12-15,47,0,journal-article,4443
10.7717/peerj.12010,10.7717,Evolutionary drivers of the hump-shaped latitudinal gradient of benthic polychaete species richness along the Southeastern Pacific coast,en,PeerJ,2167-8359,PeerJ,http://dx.doi.org/10.7717/peerj.12010,2021-9-27,2021-9-27,2021-9-27,2021-12-16,2021-9-27,109,0,journal-article,4443
10.7717/peerj.11406,10.7717,"Shiftwork, functional bowel symptoms, and the microbiome",en,PeerJ,2167-8359,PeerJ,http://dx.doi.org/10.7717/peerj.11406,2021-5-11,2021-5-11,2021-5-11,2022-1-29,2021-5-11,58,1,journal-article,4443
10.7717/peerj.12853,10.7717,"Response of Pinus tabuliformis saplings to continuous autumn fertilization treatments in the mountains of Eastern Liaoning Province, China",en,PeerJ,2167-8359,PeerJ,http://dx.doi.org/10.7717/peerj.12853,2022-1-28,2022-1-28,2022-1-28,2022-1-29,2022-1-28,62,0,journal-article,4443
10.7717/peerj.12298,10.7717,Identification and evaluation of the novel genes for transcript normalization during female gametophyte development in sugarcane,en,PeerJ,2167-8359,PeerJ,http://dx.doi.org/10.7717/peerj.12298,2021-10-19,2021-10-19,2021-10-19,2021-12-16,2021-10-19,36,0,journal-article,4443
10.7717/peerj.11244,10.7717,Semidry acid hydrolysis of cellulose sustained by autoclaving for production of reducing sugars for bacterial biohydrogen generation from various cellulose feedstock,en,PeerJ,2167-8359,PeerJ,http://dx.doi.org/10.7717/peerj.11244,2021-4-19,2021-4-19,2021-4-19,2021-12-16,2021-4-19,71,0,journal-article,4443
10.7717/peerj.10759,10.7717,Molecular systematics of the Sicista tianschanica species complex: a contribution from historical DNA analysis,en,PeerJ,2167-8359,PeerJ,http://dx.doi.org/10.7717/peerj.10759,2021-1-12,2021-1-12,2021-1-12,2021-12-16,2021-1-12,53,0,journal-article,4443
10.7717/peerj.11812,10.7717,Co-expression network and comparative transcriptome analysis for fiber initiation and elongation reveal genetic differences in two lines from upland cotton CCRI70 RIL population,en,PeerJ,2167-8359,PeerJ,http://dx.doi.org/10.7717/peerj.11812,2021-7-21,2021-7-21,2021-7-21,2021-12-16,2021-7-21,105,1,journal-article,4443
10.7717/peerj.12096,10.7717,Wedge-tailed Shearwater (Ardenna pacifica) nesting success in human-dominated coastal environments,en,PeerJ,2167-8359,PeerJ,http://dx.doi.org/10.7717/peerj.12096,2021-8-30,2021-8-30,2021-8-30,2021-12-16,2021-8-30,66,0,journal-article,4443
10.7717/peerj.11079,10.7717,Characterization of the first vaginal Lactobacillus crispatus genomes isolated in Brazil,en,PeerJ,2167-8359,PeerJ,http://dx.doi.org/10.7717/peerj.11079,2021-3-10,2021-3-10,2021-3-10,2021-12-16,2021-3-10,82,1,journal-article,4443
10.7717/peerj.11793,10.7717,Relict groups of spiny frogs indicate Late Paleogene-Early Neogene trans-Tibet dispersal of thermophile faunal elements,en,PeerJ,2167-8359,PeerJ,http://dx.doi.org/10.7717/peerj.11793,2021-7-15,2021-7-15,2021-7-15,2021-12-16,2021-7-15,95,0,journal-article,4443
10.7717/peerj.12536,10.7717,Gender specific eRNA TBX5-AS1 as the immunological biomarker for male patients with lung squamous cell carcinoma in pan-cancer screening,en,PeerJ,2167-8359,PeerJ,http://dx.doi.org/10.7717/peerj.12536,2021-11-25,2021-11-25,2021-11-25,2021-12-20,2021-11-25,50,0,journal-article,4443
10.7717/peerj.10925,10.7717,Conservation actions and ecological context: optimizing coral reef local management in the Dominican Republic,en,PeerJ,2167-8359,PeerJ,http://dx.doi.org/10.7717/peerj.10925,2021-3-9,2021-3-9,2021-3-9,2021-12-20,2021-3-9,95,2,journal-article,4443
10.7717/peerj.11305,10.7717,High fructose exposure modifies the amount of adipocyte-secreted microRNAs into extracellular vesicles in supernatants and plasma,en,PeerJ,2167-8359,PeerJ,http://dx.doi.org/10.7717/peerj.11305,2021-5-19,2021-5-19,2021-5-19,2021-12-20,2021-5-19,88,0,journal-article,4443
10.7717/peerj.10884,10.7717,Predicting lung adenocarcinoma disease progression using methylation-correlated blocks and ensemble machine learning classifiers,en,PeerJ,2167-8359,PeerJ,http://dx.doi.org/10.7717/peerj.10884,2021-2-16,2021-2-16,2021-2-16,2021-12-20,2021-2-16,68,1,journal-article,4443
10.7717/peerj.11819,10.7717,Exploration of Zoo felids in North-East China for the prevalence and molecular identification of Cryptosporidium spp.,en,PeerJ,2167-8359,PeerJ,http://dx.doi.org/10.7717/peerj.11819,2021-8-19,2021-8-19,2021-8-19,2021-12-20,2021-8-19,39,0,journal-article,4443
10.7717/peerj.10758,10.7717,Estimating the average daily rainfall in Thailand using confidence intervals for the common mean of several delta-lognormal distributions,en,PeerJ,2167-8359,PeerJ,http://dx.doi.org/10.7717/peerj.10758,2021-1-22,2021-1-22,2021-1-22,2021-12-20,2021-1-22,36,0,journal-article,4443
10.7717/peerj.12109,10.7717,Seagrass contribution to blue carbon in a shallow karstic coastal area of the Gulf of Mexico,en,PeerJ,2167-8359,PeerJ,http://dx.doi.org/10.7717/peerj.12109,2021-9-10,2021-9-10,2021-9-10,2021-12-21,2021-9-10,90,0,journal-article,4443
10.7717/peerj.10631,10.7717,The Slavcleft: a three-center study of the outcome of treatment of cleft lip and palate. Nasolabial appearance,en,PeerJ,2167-8359,PeerJ,http://dx.doi.org/10.7717/peerj.10631,2021-2-9,2021-2-9,2021-2-9,2021-12-21,2021-2-9,23,0,journal-article,4443
10.7717/peerj.12940,10.7717,SMRT sequencing of full-length transcriptome and gene expression analysis in two chemical types of Pogostemon cablin (Blanco) Benth.,en,PeerJ,2167-8359,PeerJ,http://dx.doi.org/10.7717/peerj.12940,2022-2-22,2022-2-22,2022-2-22,2022-2-22,2022-2-22,63,0,journal-article,4443
10.7717/peerj.12756,10.7717,Antifungal activity of an artificial peptide aptamer SNP-D4 against Fusarium oxysporum,en,PeerJ,2167-8359,PeerJ,http://dx.doi.org/10.7717/peerj.12756,2022-2-22,2022-2-22,2022-2-22,2022-2-22,2022-2-22,29,0,journal-article,4443
10.7717/peerj.12993,10.7717,Comparative transcriptomes of three different skin sites for the Asiatic toad (Bufo gargarizans),en,PeerJ,2167-8359,PeerJ,http://dx.doi.org/10.7717/peerj.12993,2022-2-22,2022-2-22,2022-2-22,2022-2-22,2022-2-22,65,0,journal-article,4443
10.7717/peerj.11411,10.7717,Biogeography of the Southern Ocean: environmental factors driving mesoplankton distribution South of Africa,en,PeerJ,2167-8359,PeerJ,http://dx.doi.org/10.7717/peerj.11411,2021-5-10,2021-5-10,2021-5-10,2022-2-23,2021-5-10,81,1,journal-article,4443
10.7717/peerj.11269,10.7717,Assessment of walking disorder in community-dwelling Japanese middle-aged and elderly women using an inertial sensor,en,PeerJ,2167-8359,PeerJ,http://dx.doi.org/10.7717/peerj.11269,2021-4-14,2021-4-14,2021-4-14,2021-12-13,2021-4-14,50,0,journal-article,4443
10.7717/peerj.11794,10.7717,Immediate pools of malaria infections at diagnosis combined with targeted deep sequencing accurately quantifies frequency of drug resistance mutations,en,PeerJ,2167-8359,PeerJ,http://dx.doi.org/10.7717/peerj.11794,2021-11-9,2021-11-9,2021-11-9,2021-12-13,2021-11-9,19,0,journal-article,4443
10.7717/peerj.12303,10.7717,"Punicalagin, a pomegranate compound, induces apoptosis and autophagy in acute leukemia",en,PeerJ,2167-8359,PeerJ,http://dx.doi.org/10.7717/peerj.12303,2021-11-2,2021-11-2,2021-11-2,2021-12-13,2021-11-2,54,0,journal-article,4443
10.7717/peerj.11461,10.7717,"Physiological, nutritional, and molecular responses of Brazilian sugarcane cultivars under stress by aluminum",en,PeerJ,2167-8359,PeerJ,http://dx.doi.org/10.7717/peerj.11461,2021-6-28,2021-6-28,2021-6-28,2021-12-9,2021-6-28,84,0,journal-article,4443
10.7717/peerj.11654,10.7717,The main stage of recovery after the end-Permian mass extinction: taxonomic rediversification and ecologic reorganization of marine level-bottom communities during the Middle Triassic,en,PeerJ,2167-8359,PeerJ,http://dx.doi.org/10.7717/peerj.11654,2021-7-20,2021-7-20,2021-7-20,2021-12-9,2021-7-20,151,1,journal-article,4443
10.7717/peerj.11379,10.7717,Neuroticism vulnerability factors of anxiety symptoms in adolescents and early adults: an analysis using the bi-factor model and multi-wave longitudinal model,en,PeerJ,2167-8359,PeerJ,http://dx.doi.org/10.7717/peerj.11379,2021-6-22,2021-6-22,2021-6-22,2021-12-9,2021-6-22,57,0,journal-article,4443
10.7717/peerj.11547,10.7717,"Effects of maternal taurine supplementation on maternal dietary intake, plasma metabolites and fetal growth and development in cafeteria diet fed rats",en,PeerJ,2167-8359,PeerJ,http://dx.doi.org/10.7717/peerj.11547,2021-6-3,2021-6-3,2021-6-3,2021-12-9,2021-6-3,75,0,journal-article,4443
10.7717/peerj.10955,10.7717,"Exposure-related, global alterations in innate and adaptive immunity; a consideration for re-use of non-human primates in research",en,PeerJ,2167-8359,PeerJ,http://dx.doi.org/10.7717/peerj.10955,2021-3-8,2021-3-8,2021-3-8,2021-12-9,2021-3-8,61,0,journal-article,4443
10.7717/peerj.11329,10.7717,"Genome-wide identification, classification, and expression analysis of the HSF gene family in pineapple (Ananas comosus)",en,PeerJ,2167-8359,PeerJ,http://dx.doi.org/10.7717/peerj.11329,2021-4-27,2021-4-27,2021-4-27,2021-12-9,2021-4-27,55,0,journal-article,4443
10.7717/peerj.10830,10.7717,The methylation level of TFAP2A is a potential diagnostic biomarker for retinoblastoma: an analytical validation study,en,PeerJ,2167-8359,PeerJ,http://dx.doi.org/10.7717/peerj.10830,2021-3-2,2021-3-2,2021-3-2,2021-12-31,2021-3-2,38,2,journal-article,4443
10.7717/peerj.11857,10.7717,Genome-wide association study of yield components in spring wheat collection harvested under two water regimes in Northern Kazakhstan,en,PeerJ,2167-8359,PeerJ,http://dx.doi.org/10.7717/peerj.11857,2021-7-27,2021-7-27,2021-7-27,2021-12-28,2021-7-27,56,1,journal-article,4443
10.7717/peerj.12143,10.7717,Construction of competing endogenous RNA interaction network as prognostic markers in metastatic melanoma,en,PeerJ,2167-8359,PeerJ,http://dx.doi.org/10.7717/peerj.12143,2021-9-15,2021-9-15,2021-9-15,2021-12-10,2021-9-15,38,0,journal-article,4443
10.7717/peerj.11418,10.7717,"Guiclupea superstes, gen. et sp. nov., the youngest ellimmichthyiform (clupeomorph) fish to date from the Oligocene of South China",en,PeerJ,2167-8359,PeerJ,http://dx.doi.org/10.7717/peerj.11418,2021-6-1,2021-6-1,2021-6-1,2021-12-10,2021-6-1,81,0,journal-article,4443
10.7717/peerj.12539,10.7717,Prognostic values of the core components of the mammalian circadian clock in prostate cancer,en,PeerJ,2167-8359,PeerJ,http://dx.doi.org/10.7717/peerj.12539,2021-12-9,2021-12-9,2021-12-9,2021-12-10,2021-12-9,48,0,journal-article,4443
10.7717/peerj.11831,10.7717,Optimization of change in epicardial fat thickness for obese patients who lost weight via the bariatric surgery method using central composite and Box-Behnken experimental designs,en,PeerJ,2167-8359,PeerJ,http://dx.doi.org/10.7717/peerj.11831,2021-8-4,2021-8-4,2021-8-4,2021-12-14,2021-8-4,32,0,journal-article,4443
10.7717/peerj.11774,10.7717,Efficacy of computational predictions of the functional effect of idiosyncratic pharmacogenetic variants,en,PeerJ,2167-8359,PeerJ,http://dx.doi.org/10.7717/peerj.11774,2021-7-15,2021-7-15,2021-7-15,2021-12-14,2021-7-15,41,0,journal-article,4443
10.7717/peerj.10902,10.7717,Soil properties and root traits jointly shape fine-scale spatial patterns of bacterial community and metabolic functions within a Korean pine forest,en,PeerJ,2167-8359,PeerJ,http://dx.doi.org/10.7717/peerj.10902,2021-2-26,2021-2-26,2021-2-26,2021-12-14,2021-2-26,75,0,journal-article,4443
10.7717/peerj.12382,10.7717,"Identification of genes and gene expression associated with dispersal capacity in the mountain pine beetle, Dendroctonus ponderosae Hopkins (Coleoptera: Curculionidae)",en,PeerJ,2167-8359,PeerJ,http://dx.doi.org/10.7717/peerj.12382,2021-10-26,2021-10-26,2021-10-26,2021-12-14,2021-10-26,94,0,journal-article,4443
10.7717/peerj.11966,10.7717,Molecular genetic diversity of seaweeds morphologically related to Ulva rigida at three sites along the French Atlantic coast,en,PeerJ,2167-8359,PeerJ,http://dx.doi.org/10.7717/peerj.11966,2021-12-24,2021-12-24,2021-12-24,2021-12-25,2021-12-24,85,0,journal-article,4443
10.7717/peerj.10505,10.7717,DisCoVering potential candidates of RNAi-based therapy for COVID-19 using computational methods,en,PeerJ,2167-8359,PeerJ,http://dx.doi.org/10.7717/peerj.10505,2021-2-26,2021-2-26,2021-2-26,2022-2-16,2021-2-26,87,4,journal-article,4443
10.7717/peerj.12226,10.7717,Integrative growth physiology and transcriptome profiling of probiotic Limosilactobacillus reuteri KUB-AC5,en,PeerJ,2167-8359,PeerJ,http://dx.doi.org/10.7717/peerj.12226,2021-10-5,2021-10-5,2021-10-5,2022-2-16,2021-10-5,59,1,journal-article,4443
10.7717/peerj.12046,10.7717,COVID-19 and regional differences in the timeliness of hip-fracture surgery: an interrupted time-series analysis,en,PeerJ,2167-8359,PeerJ,http://dx.doi.org/10.7717/peerj.12046,2021-8-31,2021-8-31,2021-8-31,2022-2-16,2021-8-31,45,1,journal-article,4443
10.7717/peerj.12887,10.7717,Interrogating COVID-19 vaccine intent in the Philippines with a nationwide open-access online survey,en,PeerJ,2167-8359,PeerJ,http://dx.doi.org/10.7717/peerj.12887,2022-2-16,2022-2-16,2022-2-16,2022-2-16,2022-2-16,43,0,journal-article,4443
10.7717/peerj.12967,10.7717,PCAtest: testing the statistical significance of Principal Component Analysis in R,en,PeerJ,2167-8359,PeerJ,http://dx.doi.org/10.7717/peerj.12967,2022-2-17,2022-2-17,2022-2-17,2022-2-17,2022-2-17,26,0,journal-article,4443
10.7717/peerj.11778,10.7717,Bioactive marine metabolites derived from the Persian Gulf compared to the Red Sea: similar environments and wide gap in drug discovery,en,PeerJ,2167-8359,PeerJ,http://dx.doi.org/10.7717/peerj.11778,2021-7-28,2021-7-28,2021-7-28,2021-12-11,2021-7-28,43,0,journal-article,4443
10.7717/peerj.11191,10.7717,"Patient characteristics and cardiac surgical outcomes at a tertiary care hospital in Kenya, 2008–2017: a retrospective study",en,PeerJ,2167-8359,PeerJ,http://dx.doi.org/10.7717/peerj.11191,2021-5-10,2021-5-10,2021-5-10,2021-12-11,2021-5-10,27,0,journal-article,4443
10.7717/peerj.12197,10.7717,Multiomics-based analyses of KPNA2 highlight its multiple potentials in hepatocellular carcinoma,en,PeerJ,2167-8359,PeerJ,http://dx.doi.org/10.7717/peerj.12197,2021-9-21,2021-9-21,2021-9-21,2021-12-11,2021-9-21,43,0,journal-article,4443
10.7717/peerj.12035,10.7717,To culture or not to culture: a snapshot of culture-dependent and culture-independent bacterial diversity from peanut rhizosphere,en,PeerJ,2167-8359,PeerJ,http://dx.doi.org/10.7717/peerj.12035,2021-9-1,2021-9-1,2021-9-1,2021-12-11,2021-9-1,34,0,journal-article,4443
10.7717/peerj.12568,10.7717,Metabolomics of a cell line-derived xenograft model reveals circulating metabolic signatures for malignant mesothelioma,en,PeerJ,2167-8359,PeerJ,http://dx.doi.org/10.7717/peerj.12568,2022-1-4,2022-1-4,2022-1-4,2022-1-4,2022-1-4,25,0,journal-article,4443
10.7717/peerj.12632,10.7717,Comparative genomics of the black rot pathogen Xanthomonas campestris pv. campestris and non-pathogenic co-inhabitant Xanthomonas melonis from Trinidad reveal unique pathogenicity determinants and secretion system profiles,en,PeerJ,2167-8359,PeerJ,http://dx.doi.org/10.7717/peerj.12632,2022-1-3,2022-1-3,2022-1-3,2022-1-4,2022-1-3,89,0,journal-article,4443
10.7717/peerj.12330,10.7717,No relevant differences in conditioned pain modulation effects between parallel and sequential test design. A cross-sectional observational study,en,PeerJ,2167-8359,PeerJ,http://dx.doi.org/10.7717/peerj.12330,2021-12-14,2021-12-14,2021-12-14,2021-12-15,2021-12-14,84,0,journal-article,4443
10.7717/peerj.12462,10.7717,Occupancy of wild southern pig-tailed macaques in intact and degraded forests in Peninsular Malaysia,en,PeerJ,2167-8359,PeerJ,http://dx.doi.org/10.7717/peerj.12462,2021-12-14,2021-12-14,2021-12-14,2021-12-15,2021-12-14,99,0,journal-article,4443
10.7717/peerj.10670,10.7717,"Digital Cell Sorter (DCS): a cell type identification, anomaly detection, and Hopfield landscapes toolkit for single-cell transcriptomics",en,PeerJ,2167-8359,PeerJ,http://dx.doi.org/10.7717/peerj.10670,2021-1-13,2021-1-13,2021-1-13,2021-12-15,2021-1-13,34,2,journal-article,4443
10.7717/peerj.11732,10.7717,Dairy management practices associated with multi-drug resistant fecal commensals and Salmonella in cull cows: a machine learning approach,en,PeerJ,2167-8359,PeerJ,http://dx.doi.org/10.7717/peerj.11732,2021-7-16,2021-7-16,2021-7-16,2021-12-15,2021-7-16,32,0,journal-article,4443
10.7717/peerj.11765,10.7717,Structural and immunological characterization of an epitope within the PAN motif of ectodomain I in Babesia bovis apical membrane antigen 1 for vaccine development,en,PeerJ,2167-8359,PeerJ,http://dx.doi.org/10.7717/peerj.11765,2021-7-16,2021-7-16,2021-7-16,2021-12-15,2021-7-16,57,0,journal-article,4443
10.7717/peerj.10697,10.7717,Records of ctenophores from South Africa,en,PeerJ,2167-8359,PeerJ,http://dx.doi.org/10.7717/peerj.10697,2021-1-12,2021-1-12,2021-1-12,2021-12-15,2021-1-12,66,2,journal-article,4443
10.7717/peerj.12480,10.7717,Genomic profiling and expression analysis of the diacylglycerol kinase gene family in heterologous hexaploid wheat,en,PeerJ,2167-8359,PeerJ,http://dx.doi.org/10.7717/peerj.12480,2021-12-14,2021-12-14,2021-12-14,2021-12-15,2021-12-14,62,0,journal-article,4443
10.7717/peerj.11744,10.7717,Impacts of heat stress and storm events on the benthic communities of Kenting National Park (Taiwan),en,PeerJ,2167-8359,PeerJ,http://dx.doi.org/10.7717/peerj.11744,2021-7-23,2021-7-23,2021-7-23,2021-12-21,2021-7-23,106,1,journal-article,4443
10.7717/peerj.12233,10.7717,cdev: a ground-truth based measure to evaluate RNA-seq normalization performance,en,PeerJ,2167-8359,PeerJ,http://dx.doi.org/10.7717/peerj.12233,2021-10-4,2021-10-4,2021-10-4,2021-12-21,2021-10-4,62,0,journal-article,4443
10.7717/peerj.12380,10.7717,Overexpression of fucosyltransferase 8 reverses the inhibitory effect of high-dose dexamethasone on osteogenic response of MC3T3-E1 preosteoblasts,en,PeerJ,2167-8359,PeerJ,http://dx.doi.org/10.7717/peerj.12380,2021-12-9,2021-12-9,2021-12-9,2021-12-21,2021-12-9,37,0,journal-article,4443
10.7717/peerj.11129,10.7717,"Nutritional content of Totoaba macdonaldi (Gilbert, 1890), Antioxidants and lipid peroxidation in muscle",en,PeerJ,2167-8359,PeerJ,http://dx.doi.org/10.7717/peerj.11129,2021-3-31,2021-3-31,2021-3-31,2021-12-21,2021-3-31,58,0,journal-article,4443
10.7717/peerj.11936,10.7717,Issues of under-representation in quantitative DNA metabarcoding weaken the inference about diet of the tundra vole Microtus oeconomus,en,PeerJ,2167-8359,PeerJ,http://dx.doi.org/10.7717/peerj.11936,2021-8-26,2021-8-26,2021-8-26,2021-12-21,2021-8-26,78,0,journal-article,4443
10.7717/peerj.10840,10.7717,Marine amphipods as a new live prey for ornamental aquaculture: exploring the potential of Parhyale hawaiensis and Elasmopus pectenicrus,en,PeerJ,2167-8359,PeerJ,http://dx.doi.org/10.7717/peerj.10840,2021-2-10,2021-2-10,2021-2-10,2021-12-21,2021-2-10,75,2,journal-article,4443
10.7717/peerj.10984,10.7717,Effect of Bacillus subtilis on antioxidant enzyme activities in tomato grafting,en,PeerJ,2167-8359,PeerJ,http://dx.doi.org/10.7717/peerj.10984,2021-3-12,2021-3-12,2021-3-12,2021-12-20,2021-3-12,84,2,journal-article,4443
10.7717/peerj.12250,10.7717,Event-related potentials evoked by skin puncture reflect activation of Aβ fibers: comparison with intraepidermal and transcutaneous electrical stimulations,en,PeerJ,2167-8359,PeerJ,http://dx.doi.org/10.7717/peerj.12250,2021-10-8,2021-10-8,2021-10-8,2021-12-20,2021-10-8,82,0,journal-article,4443
10.7717/peerj.10695,10.7717,Local dynamics of a white syndrome outbreak and changes in the microbial community associated with colonies of the scleractinian brain coral Pseudodiploria strigosa,en,PeerJ,2167-8359,PeerJ,http://dx.doi.org/10.7717/peerj.10695,2021-2-2,2021-2-2,2021-2-2,2021-12-8,2021-2-2,91,9,journal-article,4443
