DOI,prefix,title,language,container-title,ISSN,publisher,URL,issued,published,published-online,indexed,created,reference-count,is-referenced-by-count,type,member
10.7717/peerj.11657,10.7717,Beetle bombing always deters praying mantises,en,PeerJ,2167-8359,PeerJ,http://dx.doi.org/10.7717/peerj.11657,2021-9-3,2021-9-3,2021-9-3,2021-12-10,2021-9-6,63,0,journal-article,4443
10.7717/peerj.12026,10.7717,Improved glucose recovery from durian peel by alkaline-catalyzed steam pretreatment,en,PeerJ,2167-8359,PeerJ,http://dx.doi.org/10.7717/peerj.12026,2021-8-18,2021-8-18,2021-8-18,2021-12-17,2021-8-18,35,0,journal-article,4443
10.7717/peerj.12811,10.7717,Defense mechanism responses to COVID-19,en,PeerJ,2167-8359,PeerJ,http://dx.doi.org/10.7717/peerj.12811,2022-2-11,2022-2-11,2022-2-11,2022-2-11,2022-2-11,78,0,journal-article,4443
10.7717/peerj.12807,10.7717,A comparative study of bacterial diversity based on effects of three different shade shed types in the rhizosphere of Panax quiquefolium L.,en,PeerJ,2167-8359,PeerJ,http://dx.doi.org/10.7717/peerj.12807,2022-2-9,2022-2-9,2022-2-9,2022-2-9,2022-2-9,57,0,journal-article,4443
10.7717/peerj.12237,10.7717,Chimpanzee facial gestures and the implications for the evolution of language,en,PeerJ,2167-8359,PeerJ,http://dx.doi.org/10.7717/peerj.12237,2021-9-22,2021-9-22,2021-9-22,2021-12-11,2021-9-22,76,0,journal-article,4443
10.7717/peerj.10755,10.7717,Thick bark can protect trees from a severe ambrosia beetle attack,en,PeerJ,2167-8359,PeerJ,http://dx.doi.org/10.7717/peerj.10755,2021-2-16,2021-2-16,2021-2-16,2021-12-11,2021-2-16,43,2,journal-article,4443
10.7717/peerj.11213,10.7717,Space-filling and benthic competition on coral reefs,en,PeerJ,2167-8359,PeerJ,http://dx.doi.org/10.7717/peerj.11213,2021-6-29,2021-6-29,2021-6-29,2021-12-11,2021-6-29,77,0,journal-article,4443
10.7717/peerj.10660,10.7717,Clusters of sub-Saharan African countries based on sociobehavioural characteristics and associated HIV incidence,en,PeerJ,2167-8359,PeerJ,http://dx.doi.org/10.7717/peerj.10660,2021-1-15,2021-1-15,2021-1-15,2021-12-11,2021-1-15,53,0,journal-article,4443
10.7717/peerj.11347,10.7717,The effects of the depth of fertilization on losses of nitrogen and phosphorus and soil fertility in the red paddy soil of China,en,PeerJ,2167-8359,PeerJ,http://dx.doi.org/10.7717/peerj.11347,2021-5-18,2021-5-18,2021-5-18,2021-12-11,2021-5-18,32,0,journal-article,4443
10.7717/peerj.11612,10.7717,"Shifting cultivation and hunting across the savanna-forest mosaic in the Gran Sabana, Venezuela: facing changes",en,PeerJ,2167-8359,PeerJ,http://dx.doi.org/10.7717/peerj.11612,2021-6-17,2021-6-17,2021-6-17,2021-12-11,2021-6-17,110,0,journal-article,4443
10.7717/peerj.11675,10.7717,Where three snail species attach while emersed in relation to heterogenous substrate temperatures underneath intertidal boulders,en,PeerJ,2167-8359,PeerJ,http://dx.doi.org/10.7717/peerj.11675,2021-7-9,2021-7-9,2021-7-9,2021-12-11,2021-7-9,71,0,journal-article,4443
10.7717/peerj.11621,10.7717,"Embryonic development and perinatal skeleton in a limbless, viviparous lizard, Anguis fragilis (Squamata: Anguimorpha)",en,PeerJ,2167-8359,PeerJ,http://dx.doi.org/10.7717/peerj.11621,2021-6-17,2021-6-17,2021-6-17,2021-12-18,2021-6-17,57,1,journal-article,4443
10.7717/peerj.11957,10.7717,"A possible brachiosaurid (Dinosauria, Sauropoda) from the mid-Cretaceous of northeastern China",en,PeerJ,2167-8359,PeerJ,http://dx.doi.org/10.7717/peerj.11957,2021-8-20,2021-8-20,2021-8-20,2021-12-18,2021-8-20,123,0,journal-article,4443
10.7717/peerj.10634,10.7717,Density estimation of tiger and leopard using spatially explicit capture–recapture framework,en,PeerJ,2167-8359,PeerJ,http://dx.doi.org/10.7717/peerj.10634,2021-2-17,2021-2-17,2021-2-17,2021-12-18,2021-2-17,61,1,journal-article,4443
10.7717/peerj.11709,10.7717,New austrolimulid from Russia supports role of Early Triassic horseshoe crabs as opportunistic taxa,en,PeerJ,2167-8359,PeerJ,http://dx.doi.org/10.7717/peerj.11709,2021-6-30,2021-6-30,2021-6-30,2022-1-30,2021-6-30,86,3,journal-article,4443
10.7717/peerj.11566,10.7717,"Description of three species of ophioplinthacids, including a new species, from a deep seamount in the Northwest Pacific Ocean",en,PeerJ,2167-8359,PeerJ,http://dx.doi.org/10.7717/peerj.11566,2021-7-2,2021-7-2,2021-7-2,2022-1-28,2021-7-2,41,1,journal-article,4443
10.7717/peerj.12829,10.7717,Factors of influence in prisoner’s dilemma task: a review of medical literature,en,PeerJ,2167-8359,PeerJ,http://dx.doi.org/10.7717/peerj.12829,2022-1-28,2022-1-28,2022-1-28,2022-1-29,2022-1-28,112,0,journal-article,4443
10.7717/peerj.12760,10.7717,"Effect of biological treatment used before harvesting and storage methods on the quality, health and microbial characteristics of unripe hazelnut in the husk (Corylus avellana L.)",en,PeerJ,2167-8359,PeerJ,http://dx.doi.org/10.7717/peerj.12760,2022-1-28,2022-1-28,2022-1-28,2022-1-29,2022-1-28,58,0,journal-article,4443
10.7717/peerj.11077,10.7717,Nitrogen fertilizer reduction in combination with Azolla cover for reducing ammonia volatilization and improving nitrogen use efficiency of rice,en,PeerJ,2167-8359,PeerJ,http://dx.doi.org/10.7717/peerj.11077,2021-3-16,2021-3-16,2021-3-16,2022-1-28,2021-3-16,55,2,journal-article,4443
10.7717/peerj.11467,10.7717,Optimized nitrogen fertilizer application strategies under supplementary irrigation improved winter wheat (Triticum aestivum L.) yield and grain protein yield,en,PeerJ,2167-8359,PeerJ,http://dx.doi.org/10.7717/peerj.11467,2021-6-2,2021-6-2,2021-6-2,2022-1-27,2021-6-2,38,1,journal-article,4443
10.7717/peerj.12706,10.7717,Metabarcoding of the phytotelmata of Pseudalcantarea grandis (Bromeliaceae) from an arid zone,en,PeerJ,2167-8359,PeerJ,http://dx.doi.org/10.7717/peerj.12706,2022-1-27,2022-1-27,2022-1-27,2022-1-28,2022-1-27,47,0,journal-article,4443
10.7717/peerj.12307,10.7717,"Leopard and spotted hyena densities in the Lake Mburo National Park, southwestern Uganda",en,PeerJ,2167-8359,PeerJ,http://dx.doi.org/10.7717/peerj.12307,2022-1-27,2022-1-27,2022-1-27,2022-1-28,2022-1-27,90,0,journal-article,4443
10.7717/peerj.10799,10.7717,The effect of ethanol concentration on the morphological and molecular preservation of insects for biodiversity studies,en,PeerJ,2167-8359,PeerJ,http://dx.doi.org/10.7717/peerj.10799,2021-2-12,2021-2-12,2021-2-12,2022-1-28,2021-2-12,36,5,journal-article,4443
10.7717/peerj.10784,10.7717,Genetic structure and historical and contemporary gene flow ofAstyanaxmexicanusin the Gulf of Mexico slope: a microsatellite-based analysis,en,PeerJ,2167-8359,PeerJ,http://dx.doi.org/10.7717/peerj.10784,2021-2-25,2021-2-25,2021-2-25,2021-12-16,2021-2-25,56,1,journal-article,4443
10.7717/peerj.11572,10.7717,Response of the characteristics of organic carbon mineralization of soft rock and soil composed of sand to soil depth,en,PeerJ,2167-8359,PeerJ,http://dx.doi.org/10.7717/peerj.11572,2021-6-4,2021-6-4,2021-6-4,2021-12-16,2021-6-4,43,0,journal-article,4443
10.7717/peerj.12081,10.7717,Hallmarks of glycogene expression and glycosylation pathways in squamous and adenocarcinoma cervical cancer,en,PeerJ,2167-8359,PeerJ,http://dx.doi.org/10.7717/peerj.12081,2021-8-31,2021-8-31,2021-8-31,2021-12-16,2021-8-31,81,0,journal-article,4443
10.7717/peerj.11698,10.7717,"LncRNA AC007255.1, an immune-related prognostic enhancer RNA in esophageal cancer",en,PeerJ,2167-8359,PeerJ,http://dx.doi.org/10.7717/peerj.11698,2021-7-14,2021-7-14,2021-7-14,2021-12-16,2021-7-14,40,0,journal-article,4443
10.7717/peerj.11353,10.7717,"Comparison of morphology, development and expression patterns of hsf and hsp11.0 of Cotesia chilonis under normal and high temperature",en,PeerJ,2167-8359,PeerJ,http://dx.doi.org/10.7717/peerj.11353,2021-4-27,2021-4-27,2021-4-27,2021-12-20,2021-4-27,46,0,journal-article,4443
10.7717/peerj.12284,10.7717,Age and lunar cycle predict harbor porpoise bycatch in the south-western Baltic Sea,en,PeerJ,2167-8359,PeerJ,http://dx.doi.org/10.7717/peerj.12284,2021-10-27,2021-10-27,2021-10-27,2021-12-20,2021-10-27,71,0,journal-article,4443
10.7717/peerj.12098,10.7717,Near-natural transformation of Pinus tabuliformis better improve soil nutrients and soil microbial community,en,PeerJ,2167-8359,PeerJ,http://dx.doi.org/10.7717/peerj.12098,2021-9-23,2021-9-23,2021-9-23,2021-12-21,2021-9-23,74,0,journal-article,4443
10.7717/peerj.11656,10.7717,Prediction model of emergency mortality risk in patients with acute upper gastrointestinal bleeding: a retrospective study,en,PeerJ,2167-8359,PeerJ,http://dx.doi.org/10.7717/peerj.11656,2021-6-24,2021-6-24,2021-6-24,2021-12-21,2021-6-24,45,0,journal-article,4443
10.7717/peerj.12157,10.7717,Development of droplet digital Polymerase Chain Reaction assays for the detection of long-finned (Anguilla dieffenbachii) and short-finned (Anguilla australis) eels in environmental samples,en,PeerJ,2167-8359,PeerJ,http://dx.doi.org/10.7717/peerj.12157,2021-9-27,2021-9-27,2021-9-27,2021-12-21,2021-9-27,110,0,journal-article,4443
10.7717/peerj.11707,10.7717,Genome-wide association study uncovers new genetic loci and candidate genes underlying seed chilling-germination in maize,en,PeerJ,2167-8359,PeerJ,http://dx.doi.org/10.7717/peerj.11707,2021-6-28,2021-6-28,2021-6-28,2022-3-5,2021-6-28,50,3,journal-article,4443
10.7717/peerj.10765,10.7717,Comparative transcriptome analyses of maize seedling root responses to salt stress,en,PeerJ,2167-8359,PeerJ,http://dx.doi.org/10.7717/peerj.10765,2021-3-2,2021-3-2,2021-3-2,2022-3-5,2021-3-2,53,4,journal-article,4443
10.7717/peerj.12299,10.7717,Misinformation effects in an online sample: results of an experimental study with a five day retention interval,en,PeerJ,2167-8359,PeerJ,http://dx.doi.org/10.7717/peerj.12299,2021-11-18,2021-11-18,2021-11-18,2021-12-10,2021-11-18,36,0,journal-article,4443
10.7717/peerj.11500,10.7717,Myocardial contrast echocardiography assessment of mouse myocardial infarction: comparison of kinetic parameters with conventional methods,en,PeerJ,2167-8359,PeerJ,http://dx.doi.org/10.7717/peerj.11500,2021-6-1,2021-6-1,2021-6-1,2021-12-10,2021-6-1,40,0,journal-article,4443
10.7717/peerj.11790,10.7717,"Fusion neural networks for plant classification: learning to combine RGB, hyperspectral, and lidar data",en,PeerJ,2167-8359,PeerJ,http://dx.doi.org/10.7717/peerj.11790,2021-7-29,2021-7-29,2021-7-29,2021-12-10,2021-7-29,67,0,journal-article,4443
10.7717/peerj.11594,10.7717,Genome-wide identification and characterization of UBP gene family in wheat (Triticum aestivum L.),en,PeerJ,2167-8359,PeerJ,http://dx.doi.org/10.7717/peerj.11594,2021-6-15,2021-6-15,2021-6-15,2021-12-10,2021-6-15,75,1,journal-article,4443
10.7717/peerj.11482,10.7717,Circ_0030235 knockdown protects H9c2 cells against OGD/R-induced injury via regulation of miR-526b,en,PeerJ,2167-8359,PeerJ,http://dx.doi.org/10.7717/peerj.11482,2021-11-16,2021-11-16,2021-11-16,2021-12-10,2021-11-16,51,0,journal-article,4443
10.7717/peerj.12417,10.7717,Reactions of two xeric-congeneric species of Centaurea (Asteraceae) to soils with different pH values and iron availability,en,PeerJ,2167-8359,PeerJ,http://dx.doi.org/10.7717/peerj.12417,2021-11-10,2021-11-10,2021-11-10,2021-12-10,2021-11-10,86,0,journal-article,4443
10.7717/peerj.11837,10.7717,Acoustic individuality in the hissing calls of the male black grouse (Lyrurus tetrix),en,PeerJ,2167-8359,PeerJ,http://dx.doi.org/10.7717/peerj.11837,2021-9-9,2021-9-9,2021-9-9,2021-12-10,2021-9-9,38,0,journal-article,4443
10.7717/peerj.12179,10.7717,"Identification and characterization of expression profiles of neuropeptides and their GPCRs in the swimming crab, Portunus trituberculatus",en,PeerJ,2167-8359,PeerJ,http://dx.doi.org/10.7717/peerj.12179,2021-9-15,2021-9-15,2021-9-15,2021-12-10,2021-9-15,122,1,journal-article,4443
10.7717/peerj.12142,10.7717,Compositional distinction of gut microbiota between Han Chinese and Tibetan populations with liver cirrhosis,en,PeerJ,2167-8359,PeerJ,http://dx.doi.org/10.7717/peerj.12142,2021-9-15,2021-9-15,2021-9-15,2021-12-10,2021-9-15,52,0,journal-article,4443
10.7717/peerj.12194,10.7717,Phage strategies facilitate bacterial coexistence under environmental variability,en,PeerJ,2167-8359,PeerJ,http://dx.doi.org/10.7717/peerj.12194,2021-11-4,2021-11-4,2021-11-4,2021-12-10,2021-11-4,93,0,journal-article,4443
10.7717/peerj.12066,10.7717,The biomechanical characteristics of the strongman atlas stone lift,en,PeerJ,2167-8359,PeerJ,http://dx.doi.org/10.7717/peerj.12066,2021-9-1,2021-9-1,2021-9-1,2021-12-10,2021-9-1,36,0,journal-article,4443
10.7717/peerj.10681,10.7717,Exploring a model-based analysis of patient derived xenograft studies in oncology drug development,en,PeerJ,2167-8359,PeerJ,http://dx.doi.org/10.7717/peerj.10681,2021-1-27,2021-1-27,2021-1-27,2021-12-10,2021-1-27,16,0,journal-article,4443
10.7717/peerj.11157,10.7717,A DNA barcode library for the butterflies of North America,en,PeerJ,2167-8359,PeerJ,http://dx.doi.org/10.7717/peerj.11157,2021-4-19,2021-4-19,2021-4-19,2022-3-7,2021-4-19,100,3,journal-article,4443
10.7717/peerj.11076,10.7717,Genome-wide investigation of the AP2/ERF superfamily and their expression under salt stress in Chinese willow (Salix matsudana),en,PeerJ,2167-8359,PeerJ,http://dx.doi.org/10.7717/peerj.11076,2021-4-13,2021-4-13,2021-4-13,2022-3-7,2021-4-13,50,3,journal-article,4443
10.7717/peerj.13052,10.7717,"Loss of gut microbial diversity in the cultured, agastric fish, Mexican pike silverside (<i>Chirostoma estor</i>: Atherinopsidae)",en,PeerJ,2167-8359,PeerJ,http://dx.doi.org/10.7717/peerj.13052,2022-3-7,2022-3-7,2022-3-7,2022-3-7,2022-3-7,64,0,journal-article,4443
10.7717/peerj.12191,10.7717,Impact of urbanization on functional diversity in macromycete communities along an urban ecosystem in Southwest Mexico,en,PeerJ,2167-8359,PeerJ,http://dx.doi.org/10.7717/peerj.12191,2021-9-21,2021-9-21,2021-9-21,2022-3-7,2021-9-21,106,1,journal-article,4443
10.7717/peerj.13058,10.7717,Analyzing the relationship between self-efficacy and impulsivity in amateur soccer referees,en,PeerJ,2167-8359,PeerJ,http://dx.doi.org/10.7717/peerj.13058,2022-3-4,2022-3-4,2022-3-4,2022-3-4,2022-3-4,43,0,journal-article,4443
10.7717/peerj.12304,10.7717,A novel pyroptosis-associated gene signature for immune status and prognosis of cutaneous melanoma,en,PeerJ,2167-8359,PeerJ,http://dx.doi.org/10.7717/peerj.12304,2021-10-14,2021-10-14,2021-10-14,2022-3-4,2021-10-14,51,1,journal-article,4443
10.7717/peerj.11151,10.7717,Research progress on the application of feed additives in ruminal methane emission reduction: a review,en,PeerJ,2167-8359,PeerJ,http://dx.doi.org/10.7717/peerj.11151,2021-3-31,2021-3-31,2021-3-31,2022-3-8,2021-3-31,134,2,journal-article,4443
10.7717/peerj.11991,10.7717,Genomic analysis of early transmissibility assessment of the D614G mutant strain of SARS-CoV-2 in travelers returning to Taiwan from the United States of America,en,PeerJ,2167-8359,PeerJ,http://dx.doi.org/10.7717/peerj.11991,2021-9-2,2021-9-2,2021-9-2,2022-3-8,2021-9-2,35,1,journal-article,4443
10.7717/peerj.12022,10.7717,The syndemic condition of psychosocial problems related to depression among sexually transmitted infections patients,en,PeerJ,2167-8359,PeerJ,http://dx.doi.org/10.7717/peerj.12022,2021-9-21,2021-9-21,2021-9-21,2021-12-8,2021-9-21,57,0,journal-article,4443
10.7717/peerj.11120,10.7717,PhyloPrimer: a taxon-specific oligonucleotide design platform,en,PeerJ,2167-8359,PeerJ,http://dx.doi.org/10.7717/peerj.11120,2021-4-29,2021-4-29,2021-4-29,2021-12-8,2021-4-29,66,0,journal-article,4443
10.7717/peerj.11222,10.7717,The postcranial skeleton of Cerrejonisuchus improcerus (Crocodyliformes: Dyrosauridae) and the unusual anatomy of dyrosaurids,en,PeerJ,2167-8359,PeerJ,http://dx.doi.org/10.7717/peerj.11222,2021-5-10,2021-5-10,2021-5-10,2021-12-8,2021-5-10,114,0,journal-article,4443
10.7717/peerj.11865,10.7717,ensembleTax: an R package for determinations of ensemble taxonomic assignments of phylogenetically-informative marker gene sequences,en,PeerJ,2167-8359,PeerJ,http://dx.doi.org/10.7717/peerj.11865,2021-7-26,2021-7-26,2021-7-26,2021-12-8,2021-7-26,46,0,journal-article,4443
10.7717/peerj.12343,10.7717,Genome-wide association study and population structure analysis of seed-bound amino acids and total protein in watermelon,en,PeerJ,2167-8359,PeerJ,http://dx.doi.org/10.7717/peerj.12343,2021-10-19,2021-10-19,2021-10-19,2021-12-12,2021-10-19,78,0,journal-article,4443
10.7717/peerj.10974,10.7717,"Forbidden links, trait matching and modularity in plant-hummingbird networks: Are specialized modules characterized by higher phenotypic floral integration?",en,PeerJ,2167-8359,PeerJ,http://dx.doi.org/10.7717/peerj.10974,2021-3-10,2021-3-10,2021-3-10,2021-12-12,2021-3-10,98,0,journal-article,4443
10.7717/peerj.11340,10.7717,New insight into the divergent responses of plants to warming in the context of root endophytic bacterial and fungal communities,en,PeerJ,2167-8359,PeerJ,http://dx.doi.org/10.7717/peerj.11340,2021-5-26,2021-5-26,2021-5-26,2021-12-11,2021-5-26,76,0,journal-article,4443
10.7717/peerj.12523,10.7717,A new and very spiny lizard (Gymnophthalmidae: Echinosaura) from the Andes in northwestern Ecuador,en,PeerJ,2167-8359,PeerJ,http://dx.doi.org/10.7717/peerj.12523,2021-12-10,2021-12-10,2021-12-10,2021-12-11,2021-12-10,39,0,journal-article,4443
10.7717/peerj.11159,10.7717,"Association between Dietary Inflammatory Index and Type 2 diabetes mellitus in Xinjiang Uyghur autonomous region, China",en,PeerJ,2167-8359,PeerJ,http://dx.doi.org/10.7717/peerj.11159,2021-7-16,2021-7-16,2021-7-16,2021-12-11,2021-7-16,39,0,journal-article,4443
10.7717/peerj.12275,10.7717,Prognostic model of AU-rich genes predicting the prognosis of lung adenocarcinoma,en,PeerJ,2167-8359,PeerJ,http://dx.doi.org/10.7717/peerj.12275,2021-10-8,2021-10-8,2021-10-8,2021-12-21,2021-10-8,64,1,journal-article,4443
10.7717/peerj.12277,10.7717,The correlation of WDR76 expression with survival outcomes and immune infiltrates in lung adenocarcinoma,en,PeerJ,2167-8359,PeerJ,http://dx.doi.org/10.7717/peerj.12277,2021-10-4,2021-10-4,2021-10-4,2021-12-21,2021-10-4,33,0,journal-article,4443
10.7717/peerj.11530,10.7717,Spondias mombin as a reservoir of fruit fly parasitoid populations in the Eastern Amazon: an undervalued ecosystem service,en,PeerJ,2167-8359,PeerJ,http://dx.doi.org/10.7717/peerj.11530,2021-6-4,2021-6-4,2021-6-4,2021-12-21,2021-6-4,112,0,journal-article,4443
10.7717/peerj.10751,10.7717,Age-related abnormalities of thalamic shape and dynamic functional connectivity after three hours of sleep restriction,en,PeerJ,2167-8359,PeerJ,http://dx.doi.org/10.7717/peerj.10751,2021-1-26,2021-1-26,2021-1-26,2021-12-21,2021-1-26,44,2,journal-article,4443
10.7717/peerj.12186,10.7717,Detection of syrup adulterants in manuka and jarrah honey using HPTLC-multivariate data analysis,en,PeerJ,2167-8359,PeerJ,http://dx.doi.org/10.7717/peerj.12186,2021-9-22,2021-9-22,2021-9-22,2021-12-21,2021-9-22,60,0,journal-article,4443
10.7717/peerj.11249,10.7717,"Defensive behavior of the invasive alien hornet, Vespa velutina, against color, hair and auditory stimuli of potential aggressors",en,PeerJ,2167-8359,PeerJ,http://dx.doi.org/10.7717/peerj.11249,2021-4-6,2021-4-6,2021-4-6,2021-12-21,2021-4-6,77,0,journal-article,4443
10.7717/peerj.11522,10.7717,Freshwater-adapted sea bass Dicentrarchus labrax feeding frequency impact in a lettuce Lactuca sativa aquaponics system,en,PeerJ,2167-8359,PeerJ,http://dx.doi.org/10.7717/peerj.11522,2021-6-3,2021-6-3,2021-6-3,2021-12-21,2021-6-3,102,0,journal-article,4443
10.7717/peerj.12508,10.7717,Proteomic profiling of the endogenous peptides of MRSA and MSSA,en,PeerJ,2167-8359,PeerJ,http://dx.doi.org/10.7717/peerj.12508,2021-11-24,2021-11-24,2021-11-24,2021-12-10,2021-11-24,54,0,journal-article,4443
10.7717/peerj.10671,10.7717,RNA sequencing analysis of FGF2-responsive transcriptome in skin fibroblasts,en,PeerJ,2167-8359,PeerJ,http://dx.doi.org/10.7717/peerj.10671,2021-1-15,2021-1-15,2021-1-15,2021-12-10,2021-1-15,35,0,journal-article,4443
10.7717/peerj.12234,10.7717,Vitamin D serum levels and non-melanoma skin cancer risk,en,PeerJ,2167-8359,PeerJ,http://dx.doi.org/10.7717/peerj.12234,2021-9-24,2021-9-24,2021-9-24,2021-12-10,2021-9-24,58,0,journal-article,4443
10.7717/peerj.11058,10.7717,"Quantitative study of the behavior of two broadcast spawners, the sea urchinsStrongylocentrotus intermediusandMesocentrotus nudus, during mass spawning events in situ",en,PeerJ,2167-8359,PeerJ,http://dx.doi.org/10.7717/peerj.11058,2021-4-6,2021-4-6,2021-4-6,2021-12-10,2021-4-6,60,0,journal-article,4443
10.7717/peerj.12486,10.7717,"No evidence of effects or interaction between the widely used herbicide, glyphosate, and a common parasite in bumble bees",en,PeerJ,2167-8359,PeerJ,http://dx.doi.org/10.7717/peerj.12486,2021-11-17,2021-11-17,2021-11-17,2021-12-10,2021-11-17,76,0,journal-article,4443
10.7717/peerj.12403,10.7717,The posttraumatic stress interview for children (KID-PIN): development and validation of a semi-structured interview of PTSD symptoms among displaced children in the Middle East,en,PeerJ,2167-8359,PeerJ,http://dx.doi.org/10.7717/peerj.12403,2021-12-15,2021-12-15,2021-12-15,2021-12-19,2021-12-15,54,0,journal-article,4443
10.7717/peerj.11491,10.7717,Using a mobile health app to improve patients’ adherence to hypertension treatment: a non-randomized clinical trial,en,PeerJ,2167-8359,PeerJ,http://dx.doi.org/10.7717/peerj.11491,2021-5-28,2021-5-28,2021-5-28,2021-12-19,2021-5-28,61,1,journal-article,4443
10.7717/peerj.12039,10.7717,Measuring walking impairment in patients with intermittent claudication: psychometric properties of the Walking Estimated-Limitation Calculated by History (WELCH) questionnaire,en,PeerJ,2167-8359,PeerJ,http://dx.doi.org/10.7717/peerj.12039,2021-8-26,2021-8-26,2021-8-26,2021-12-19,2021-8-26,43,0,journal-article,4443
10.7717/peerj.11920,10.7717,Extraction behaviors of aqueous PEG impregnated resin system in terms of impregnation stability and recovery via protein impregnated resin interactions on bovine serum albumin,en,PeerJ,2167-8359,PeerJ,http://dx.doi.org/10.7717/peerj.11920,2021-12-6,2021-12-6,2021-12-6,2021-12-19,2021-12-6,21,0,journal-article,4443
10.7717/peerj.12326,10.7717,Vocal communication in wild chimpanzees: a call rate study,en,PeerJ,2167-8359,PeerJ,http://dx.doi.org/10.7717/peerj.12326,2021-10-19,2021-10-19,2021-10-19,2021-12-19,2021-10-19,83,0,journal-article,4443
10.7717/peerj.10688,10.7717,The functional analysis of ABCG transporters in the adaptation of pigeon pea (Cajanus cajan) to abiotic stresses,en,PeerJ,2167-8359,PeerJ,http://dx.doi.org/10.7717/peerj.10688,2021-1-19,2021-1-19,2021-1-19,2021-12-19,2021-1-19,70,1,journal-article,4443
10.7717/peerj.11265,10.7717,Explorations of avoidance and approach coping and perceived stress with a computer-based avatar task: detrimental effects of resignation and withdrawal,en,PeerJ,2167-8359,PeerJ,http://dx.doi.org/10.7717/peerj.11265,2021-4-15,2021-4-15,2021-4-15,2021-12-19,2021-4-15,71,0,journal-article,4443
10.7717/peerj.12280,10.7717,Experimental validation of otolith-based age and growth reconstructions across multiple life stages of a critically endangered estuarine fish,en,PeerJ,2167-8359,PeerJ,http://dx.doi.org/10.7717/peerj.12280,2021-11-17,2021-11-17,2021-11-17,2021-12-19,2021-11-17,63,0,journal-article,4443
10.7717/peerj.11801,10.7717,Relationship between impulsivity and suicide among the rural elderly in China: a case-control psychological autopsy study,en,PeerJ,2167-8359,PeerJ,http://dx.doi.org/10.7717/peerj.11801,2021-7-27,2021-7-27,2021-7-27,2021-12-9,2021-7-27,36,1,journal-article,4443
10.7717/peerj.12487,10.7717,Probabilistic risk assessment and water quality index of a tropical delta river,en,PeerJ,2167-8359,PeerJ,http://dx.doi.org/10.7717/peerj.12487,2021-11-29,2021-11-29,2021-11-29,2021-12-9,2021-11-29,78,0,journal-article,4443
10.7717/peerj.12222,10.7717,Response of plant diversity and soil physicochemical properties to different gap sizes in a Pinus massoniana plantation,en,PeerJ,2167-8359,PeerJ,http://dx.doi.org/10.7717/peerj.12222,2021-9-21,2021-9-21,2021-9-21,2021-12-9,2021-9-21,75,0,journal-article,4443
10.7717/peerj.12449,10.7717,Genomic diversity of SARS-CoV-2 in Malaysia,en,PeerJ,2167-8359,PeerJ,http://dx.doi.org/10.7717/peerj.12449,2021-11-3,2021-11-3,2021-11-3,2021-12-9,2021-11-3,33,0,journal-article,4443
10.7717/peerj.10854,10.7717,The tetrapod fauna of the upper Permian Naobaogou Formation of China: 6. Turfanodon jiufengensis sp. nov. (Dicynodontia),en,PeerJ,2167-8359,PeerJ,http://dx.doi.org/10.7717/peerj.10854,2021-2-17,2021-2-17,2021-2-17,2021-12-9,2021-2-17,69,1,journal-article,4443
10.7717/peerj.11046,10.7717,Learning to perform role-filler binding with schematic knowledge,en,PeerJ,2167-8359,PeerJ,http://dx.doi.org/10.7717/peerj.11046,2021-3-31,2021-3-31,2021-3-31,2021-12-9,2021-3-31,46,1,journal-article,4443
10.7717/peerj.11872,10.7717,Proteomic analysis reveals some common proteins in the kidney stone matrix,en,PeerJ,2167-8359,PeerJ,http://dx.doi.org/10.7717/peerj.11872,2021-7-27,2021-7-27,2021-7-27,2021-12-9,2021-7-27,52,0,journal-article,4443
10.7717/peerj.10822,10.7717,Phenotype characteristics of gastric epithelial mucus in patients with different gastric diseases: from superficial gastritis to gastric cancer,en,PeerJ,2167-8359,PeerJ,http://dx.doi.org/10.7717/peerj.10822,2021-2-25,2021-2-25,2021-2-25,2021-12-9,2021-2-25,34,0,journal-article,4443
10.7717/peerj.10500,10.7717,Transcriptional profile in rat muscle: down-regulation networks in acute strenuous exercise,en,PeerJ,2167-8359,PeerJ,http://dx.doi.org/10.7717/peerj.10500,2021-4-2,2021-4-2,2021-4-2,2021-12-9,2021-4-2,53,0,journal-article,4443
